<?xml version="1.0" encoding="UTF-8"?>
        <!ELEMENT pointsList (point*)>
        <!ATTLIST point units (cm|mm|px) #REQUIRED>
        <!ELEMENT point (x,y)>
        <!ELEMENT x (#PCDATA)>
        <!ELEMENT y (#PCDATA)>